高蛋白質的食物中含有胺基酸和肌酸物質，在火焰下直接燒炙，會產生致癌物質，因避免油炸和燒烤的肉類和加工食品。,1
蛋白質含量的食物如牛、豬、魚、雞，含胺基酸和肌酸會分解或變性產生異環胺。,1
肉如果在溫度過高的環境下會變質，對人體產生有害物質，盡量減少高溫烹調以及直接暴露在火焰上。,1
文中提及的肉品富含胺基酸和肌酸，並且在高於攝氏一百五十度時會產生危害人體的物質，並避免食用加工肉品。,1
因高蛋白含量的食物，在一百五十度的高溫下會產生致癌物質，所以應避免攝取烤焦和加工食品。,1
高蛋白質的食物在高溫烹煮食會使蛋白質分解或變形產生異環胺，但是溫度越高時間越長則是產生更多致癌的多環芳香烴。,1
就是說牛、豬、魚、雞肉因為含有高蛋白質不適合高溫或火焰下直接燒炙也不適合加溫時間過長會產生致癌性高的物質建議先微波減少高溫烹煮或少吃肉。,1
高蛋白質含量的食物如牛、豬、魚、雞肉，因富含胺基酸和肌酸，烹煮溫度高於150度，攝取過多，會提高罹患大腸癌的風險。,1
日常生活中，很多我們不太會去注意到的燒烤、油炸類食品都容易致癌，避免過量攝取肉類或加工食品，才是健康。,1
若攝取大量燒烤、油炸的肉類，會提高罹患大腸癌的風險。,1
在高溫下烹煮時，蛋白質會分解出異環胺，為了減少它的生成，要避免長時間高溫下烹煮跟攝取過量的肉類才會健康無害。,1
高蛋白質的食物，在高於150度的溫度烹煮時，會產生異環胺，為了避免這種狀況發生減少高溫烹調的時間以免致癌。,1
不要用太過於高溫的加熱器材來加熱食材，也不要烹煮食材太久，烤焦的食材也盡量不要吃，因為這些會導致我們身體罹患大腸癌的風險高。,1
我們常吃的高蛋白食物例如：牛、豬、魚、雞肉等，因富含胺基酸和肌酸，所以在高於一百五十度的溫度時，會導致更多異環胺的生成，甚至產生致癌。,1
國人熱愛中秋烤肉，或是西方的燒烤肉食，及長時間高溫加工製成煙燻肉品，具大量異環胺及多環芳香烴，避免過量。,1
高蛋白質含量的食物如牛、豬、魚、雞肉因富含胺基酸和肌酸，若在高溫150度下料理及可能致癌。,1
蛋白質在高溫、加溫時間長，易產生致癌物質，所以高蛋白質含量的食物烹調方式要低溫、時間短，要均衡營養。,1
高蛋白質含量的食物在高溫烹煮之下會產生異環胺及多環芳香烴這兩類物質在體內經酵素活化後會破壞DNA而致癌。,1
高蛋白食物如牛、豬、魚、雞肉，富含胺基酸和肌酸，高於150度溫度烹煮食，蛋白質會變性而產生異環胺，甚至產生致癌性高的多環芳香烴。這兩類食物被體內經特殊酵素代謝活化後，有可能破壞去氧核醣核酸，因而致癌。,1
主要在說明高蛋白含量的食物在高於150度的高溫下會產生異環胺且致癌的多環芳香烴，且常出現於煙燻肉品中。,1
高蛋白的食物在高溫烹煮下會產生致癌物質，所以盡量避免長時間的高溫烹調高蛋白食物。,1
主要說明胺基酸和肌酸在溫度高於150度的時候會釋放對人體有害的物質，因此我們在烹調的時候要注意且避免。,1
這些高蛋白質的食物，要如何正確食用，才能達到真正的功效，而不是反成為致癌的食物。,1
在高溫烹煮的高蛋白質會產生致癌物，所以要盡量避免。,1
本文要傳遞的主要訊息是適量攝取燒烤過的肉類及加工肉類食品，以避免過量攝取有害人體的多環芳香烴等化學物質。,1
國人熱愛的中秋炭烤含有胺基酸和肌酸在高溫烹煮會分解變性應加罹患大腸癌的致癌性物質。,1
高蛋白質的食物，因富含胺基酸和肌酸，在高於一百五十度的溫度烹煮時，蛋白質會分解或變性而產生異環胺。,1
本文主要傳遞的訊息為因為高蛋白質含量較高的肉類富含胺基酸、基酸，所以應該避免過於長時間的加熱，否則會有產生致癌性的物質多環芳香烴，食用入體內經代謝會破壞DNA因而致癌，因此我們在日常生活中要減少攝取過多以炭烤或燒烤的食物。,1
高蛋白含量食物如牛、豬、魚、雞肉，因富含胺基酸和肌酸，在高溫下異產生異環胺與多環芳香烴，食用過多易至癌。,1
牛肉、豬肉、魚肉、雞肉含有胺基酸和肌酸所以會破壞去氧核醣核酸，導致罹癌，如果擔心的話最好先微波肉類和減少高溫烹調的時間。,1
高蛋白質的食物，在高於150度的溫度烹煮時，可能產生致癌性高的物質，若大量攝取會提高大腸癌的風險。,1
內容主要在講解高蛋白質內的胺基酸及肌酸，高溫加熱可能致癌，如何避免及均衡攝取營養。,1
有許多食物是含量高蛋白質，例如牛、豬、魚、雞肉等，國人喜愛將這些食物高溫烹調，以致於產生許多致癌風險，飲食需均衡。,1
牛、豬、魚、雞肉，都富有胺基酸和肌酸，若高溫和過長的加溫時間會產生，更多異環胺，甚至產生致癌物質。,1
避免過量攝取在高溫下烹調的肉類及加工食品。,1
長期吃烤肉和油炸等直接暴露在火中的食物，對身體非常不好，會破壞去氧核醣核酸會致癌，提高得大腸癌的機率。,1
國內人喜愛吃燒烤、油炸類的食物，如果長時間的去食用，將可能提高大腸癌的風險。所以要減少食用該類型食物。,1
高蛋白質含量的食物在高溫下會產生出比一般烹煮下還多的致癌物質，所以少吃高溫煮的肉類。,1
高蛋白質的食物在高於150度的溫度煮過後會產生致癌性高的物質，應該避免吃過量的加工式高溫烹調的料理。,1
了解富含高蛋白質的肉品在高溫下產生的致癌物，並加以告訴如何避免吃下過量的致癌物，身體才會健康長久。,1
避免高蛋白質含量的食物在高溫下長時間烹煮，也要避免過量攝取肉類及加工食品才能吃的健康。,1
這文章主要再說吃太多烤焦的蛋豆魚肉類會提高罹患大腸癌的風險。,1
油炸類及燒烤應少吃，預防癌症，均衡及健康之飲食才是最好的。,1
長食用燒烤或加工類的食品會提高罹患大腸癌的風險，一般食物長時間處於高溫都會產生異環胺和多環芳香烴，這兩種都是破壞去氧核醣核酸，因而致癌的。,1
若攝取大量燒烤、油炸的肉類，會提高罹患大腸癌的風險。,1
高蛋白的食物在高於150度的烹煮中，會產生兩種物質，而這兩種物質會破壞體內的去氧核醣核酸，而且會致癌，所以不要攝取過多高溫燒烤及油炸的食品，來破壞身體內許多的好物質了。,1
國人或是西方常食用燒烤之肉食，因此罹患大腸癌的機率也高，若要記降低罹癌風險，應少吃高溫烹調的肉品。,1
因高蛋白質含量的食物富含胺基酸和肌酸，要避免在高溫下烹煮，這兩類物質經酵素活化後，恐導致致癌。,1
高蛋白質的肉類如果經高溫烹調，會產生致癌性高的物質食用後因體內消化系統的酵素作用使人致癌的風險增高，為避免日後有健康問題我們應將肉類做適當的烹調並不可攝取過度肉類及加工食品才能保持健康的身體。,1
本文主要傳遞訊息為，牛、豬、魚、雞肉等肉類不應高溫且長時間進行烹調，否則會產生有害人體健康的物質。,1
高蛋白質的食物如牛、豬、魚、雞肉，具胺基酸及肌酸，若長時間直接於火焰下燒炙將會產生異環胺，甚至產生高致癌性的多環芳香烴。這兩種經體內特殊的酵素代謝活化後，可能會破壞去氧核醣核酸，因而致癌。我們應當避免攝取過多的肉類，且肉類之處理可先用微波爐料理減少高溫烹調的時間，需飲食均衡方使身體健康。,1
蛋白質的食物在高於150度的溫度烹煮時，蛋白質會分解或變性而產生異環胺，這是正常產生的物質。但是如果溫度越高，加溫時間越長，會導致更多異環胺生成，會產生致癌物質，所以食用東西的時候要均衡攝取營養。,1
異環胺和多環芳香烴，這兩類物質過多會致癌。,1
國人常常吃炭烤、燒烤這類的食物，但是這些含有高蛋白質量的食物，因富含胺基酸和肌酸，在高於一百五十度時會產生致癌性物質，建議少吃為妙,1
國人熱愛的炭烤、燒肉，以及長時間在高溫加工製成的煙燻肉品，都具有大量的異環胺及多環芳香烴，若攝取大量燒烤、油炸類食品，將提高大腸癌的風險。,1
利用第一段的蛋白質變異過程，告知肉類過度高溫煮所造成的化學效應，從中帶出因反應後產生的有害物質在人體消化後可能產生的風險。在探討人們可能因那些飲食習慣而提高對身體有危害機會，同時給予建議如何降低因蛋白質變異的煮食方式，和避免食用那些食品或食物。,1
高蛋白質的食物加溫時間長或溫度越高越容易產生致癌物。,1
以避免攝取過量肉類或加工食品，必均衡攝食。,1
肉類在火焰下直接燒會產生很多致癌物，如碳烤、油炸肉類能少吃就少吃。,1
含有高蛋白食物易產生致癌物質，這些食物經過高溫就會造成人的健康，應攝取均衡飲食才不容易生病。,1
高蛋白質含量的食物經高溫加熱或是在火焰下直接燒炙會導致更多異環胺生成甚至產生致癌性高的多環芳香烴。,1
蛋白質分解會產生的物質，及物質對人體的影響。,1
飲食均衡，避免攝取過多的肉類及加工食品。,1
肉類等蛋白質食物盡可能不要高溫烹煮及多量食用。,1
高蛋白含量食物，在高溫烹煮下會產生異環胺和多環芳香烴，而這兩樣物質在體內因特殊酵素代謝活化而致癌。我國人又熱愛吃這些有較大量的致癌食物，因避免過量攝取，均衡營養才是健康。,1
高蛋白質含量的食物在溫度越高，加熱時間越長的環境下，容易產生致癌性高的風險。,1
高蛋白的食物，含胺基酸和肌酸，高於150度溫度烹煮，蛋白質會分解變性而產生異環胺，溫度越高異環胺越多，產生致癌性高的多環芳香烴，兩類物質經特殊的酵素代謝活化後，會破壞去氧核醣核酸因而致癌，不要讓肉直接暴露在火焰中，不要長時間烹煮，不要吃太多加工食品，均衡攝取營養。,1
食物不要直接火烤。,1
高蛋白質含量的食物因富含胺基酸和肌酸在高於150度的溫度下烹煮會生成異環胺攝取過多容易提高罹患癌症的風險。,1
高蛋白含量和避免過量攝取肉類或加工食品。,1
在溫度高、加溫時間長，直接燒會導致異環胺、多環芳香烴，兩個都是致癌物。,1
為了國人健康，希望國人可以不要吃燒烤或油炸食物。,1
本文主要傳遞若高蛋白質食物長時間高溫烹煮，其產生的異環胺及多環芳香烴對於人體的危害，很有可能致癌。,1
避免肉類直接暴露在火焰中，或長時間高溫下烹煮，烤肉防止攝取肉類或加工食品，均衡攝取營養才是健康王道。,1
高蛋白含量的食物，例如牛、豬、魚、雞等等，不可長時間高溫烹煮，會產生致癌物，常食用則致癌。,1
高蛋白含量的食物，在高於150度的溫度煮時會分解或變成異環胺。,1
減少吃燒烤肉食和長時間高溫加工製成的煙燻肉品才可以減少致癌的風險。,1
因為蛋白質，富含胺基酸和肌酸，這兩種物質在火焰下會產生致癌因子，所以要避免。,1
少吃對身體有害的食物，並且正確的烹煮食物才能減少身體吸收過多雜質多配合蔬菜才能吃的健康。,1
胺基酸和肌酸高溫烹煮時其蛋白質會分解或變性而產生異環胺，溫度越高、加熱時間月長會有更多異環胺生成，更可能產生致癌率高的多環芳香烴，而這兩種物質經特殊酵素代謝活化，可能破壞去氧核醣核酸而致癌，攝取大量燒烤、油炸肉類增加罹患大腸癌風險，避免肉類高溫長時間烹煮，避免過量攝取肉類、加工食品，均衡營養。,1
高蛋白質被體內經過特殊的酵素代謝活化後，有可能破壞DNA，因而致癌。,1
高蛋白質含量的食物在高於150度的溫度烹煮會分解或變性產生異環胺，溫度越高，產生致癌性高的多環芳香烴。,1
蛋白質會分解或變性而產生異環胺，破壞去氧核醣核酸，因而致癌。,1
高蛋白質含量的食物要減少高溫烹調的時間，才不會對身體有害，應均衡攝取營養才是健康王道。,1
牛、豬、魚、雞肉在高於150度的溫度烹煮食，蛋白質會分解或變性產生異環胺。,1
高蛋白質的食物含胺基酸和肌酸，在高溫150度烹煮，蛋白質會變性產生異環胺，異環胺在高溫下會產生致癌物。,1
本文所想傳遞的訊息乃是讓人充分瞭解蛋白質所含的一些物質，如內含胺基酸和肌酸等……物質，這片文章能讓人充分的了解蛋白質的作用為何。,1
因為現代人喜歡吃蛋白質含量高，又特別愛吃油炸燒烤，這樣容易罹患癌症，所以應避免肉類直接與火焰接觸，均衡的攝取營養比較好。,1
國人應少吃燒烤及加工食品，飲食需均衡攝取各類食物。,1
烤肉要避免烤焦，也避免攝取過量肉類與加工食品，均衡營養最好。,1
高蛋白質食物內含胺基酸和肌酸，高於一百五十度的烹煮蛋白質會分解或變性產生異環胺，但烹煮時間越久，溫度越高會導致過多的異環胺產生，甚至產生致癌性高多環芳香烴。這兩類物質經特殊效術活化後，可能破壞去氧核醣核酸，導致癌症引發。,1
均衡攝取營養，才是健康王道。避免過量攝取肉類或加工食品。,1
少吃炭烤油炸的肉類，避免過量攝取肉類或加工食品，均衡攝取營養才會健康。,1
高蛋白質食物如牛、豬、魚、雞肉，應減少高溫烹調的時間，避免致癌物質產生。,1
避免吃下烤焦的高蛋白質含量的肉類。由於在高於一百五十度溫度烹煮，蛋白質會破壞去氧核醣核酸，食而致癌。,1
肉類在烹煮時盡量減少高溫烹調時間，以免致癌。,1
攝取大量燒烤、油炸的肉類會提高罹患大腸癌風險，是因為破壞了DNA，所以避免過量攝取。,1
少吃致癌食品，因為國人平長的飲食素養並不是良好，提醒國人平時要多注意飲食健康，慎選吃的食物。,1
攝取高蛋白質食物時，應該要減少長時間的烹煮，少吃燒烤和油炸的肉類，均衡攝取營養。,1
健康飲食，遠離癌症。,1
主要是在傳遞說我們身體有什麼，例如像我們身體的蛋白質，怎麼去分解，怎樣才不會傷害到我們身體，另外的是教我們身體的概念以及買了吃了的後果，更重要的是教我們怎麼攝取飲食才是最棒的。,1
胺基酸和肌酸在高一百五十的高溫烹煮下，蛋白質會變成異環胺。溫度越高加溫越久，甚至產生致癌性高的多環芳香烴，這兩類物質都會提高大腸癌的風險，建議先使用微波爐料理肉類，減少高溫烹煮的時間。,1
高蛋白質含量的食物在高溫烹煮下，蛋白質易變性，產生的物質會造成健康受到威脅。,1
攝取高蛋白質飲食都要注意，不要攝取過高對身體不好，高熱量的蛋白質會被體內特殊的酵素代謝活化後去破壞DNA，因而致癌，所有高熱量的食品，都必須注意，不要攝取超過，導致身體的負擔過重。,1
高蛋白質含量的食物在高溫烹煮時，如果溫度越高、加溫時間過長，在火焰下直接燒炙會產生致癌性高的東西；所以若大量攝取燒烤、油炸的肉類，會提高大腸癌的風險，避免過量攝取肉類或加工食品，均衡攝取營養才是健康王道。,1
國人罹患大腸癌的原因。,1
本文講述了含高蛋白質的食物，如各類肉品，在高於150度的溫度下煮了吃後，會有致癌性高的多環芳香烴被我們體內特殊的酵素活化後，就有可能致癌，吃多了燒烤、油炸的肉類也會提高罹患大腸癌的風險，所以在燒烤時可以先以微波爐料理肉類烤肉食防止局過熱以及烤焦，當然避免大量肉類跟加工食品。,1
牛、豬、魚、雞肉因有胺基酸和肌酸，在高於150度的溫度下烹煮會產生蛋白質分解或變性，所以如果太常攝取或大量飲食燒烤、油炸的肉類，可能會致癌，所以要多吃青菜或少吃這類的食物，這樣才可以減少得到癌症的風險。,1
高蛋白質的食物，含胺基酸和肌酸，高於150度的溫度下烹煮，蛋白質會產生異環胺，及致癌性高的多環芳香烴。有可能破壞去氧核醣核酸而致癌。提高大腸癌的風險。因此要均衡攝取營養，才是健康王道。,1
食物盡量不要主太久，或長攝取燒烤、油炸的肉類。,1
以微波爐料理肉類，減少高溫烹調的時間，避免過量攝取肉類或加工食品，均衡攝取營養才是健康王道。,1
高蛋白含胺基酸和肌酸，在高溫150度烹煮，蛋白質會分解或變性。吃多會致癌性高，炭烤、西方燒烤肉食，長時間在高溫加工製成的煙燻肉品，避免肉類或加工食品，均衡攝取營養。,1
過高溫烹調食物，食用之後對人體的害處，所有要減少高溫烹調時間，避免過量攝取肉類及加工品。,1
吃高溫烹調過久的食物容易致癌。,1
肉類直接暴露在火焰中，或是在烹煮時溫度過高，大量攝取會傷害健康。,1
不要常吃調味較多、大量油炸、燒烤的肉類，避免攝取太多肉類或加工食品要營養均衡。,1
高蛋白質含量的食物，因富含胺基酸和肌酸，在溫度過高、時間過長的烹煮下，食用後容易致癌。,1
避免過量攝取肉類或加工食品，均衡攝取營養才是健康王道。,1
高蛋白質含量的食物盡量不要長時間高溫烹煮，避免過量攝取肉類或加工食品。,1
高蛋白質含量的食物，因有胺基酸和肌酸，在高於150度時，蛋白質會分解或變性而產生異環胺。太多則會產生致癌性高的多環芳香烴。,1
別過量攝取肉類和加工食品，若要吃盡亮先以微波爐料理肉類，減少高溫烹調的時間，避免讓肉類直接暴露在火焰中或長時間高溫烹煮。,1
最主要說明的是現代人的飲食基本上都是有問題的，如果不好好的均衡攝取則致癌的機率會相當高。,1
避免肉類常時間暴露在火焰中或長時間在高溫下烹煮，或以微波爐料理肉類，減少高溫烹調時間，烤肉要防止局部過熱，避免烤焦，均衡攝取營養。,1
高蛋白質含量的食物加溫時間越長，會產生致癌性高的物質。,1
胺基酸和肌酸，在高於150度的溫度烹煮食，蛋白質會分解或變性而產生異環胺，溫度越高、加溫時間越長會產生更多的異環胺，甚至產生致癌性高的多環芳香烴。若攝取大量燒烤、油炸類的肉，會提高罹患大腸癌的風險。當然避免過量攝取肉類或加工食品，均衡攝取營養才是健康王道。,1
含有高蛋白的食物，如果以不當的方式烹調，恐致癌。,1
經過150度以上的肉類會產生異環胺的生成這會致癌，所以不能常吃。,1
本文主要是在傳遞怎樣的飲食習慣才算健康，該少吃些什麼。,1
說明如何烤肉才會健康和避免食過多的肉類和加工食品。,1
減少攝取燒烤、油炸的肉類和避免過量食用加工食品。,1
先以微波爐料理肉類，減少高溫烹煮的時間。,1
牛、豬、魚、雞肉要避免直接暴露在火焰中，如果烤肉的話要避免烤焦，不然可以先微波，減少烹調時間，這樣能減少異環胺的生成。,1
本篇文章中主要在說明高蛋白質含量食物，在高於150度的溫度烹煮食，蛋白質會分解或變性而產生異環胺，過多異環胺會導致致癌。,1
文中所要傳遞的訊息在於告訴我們燒烤的肉類會使我們罹患大腸癌，呼籲我們少吃炭烤肉及煙燻肉品。,1
若經常食用煙燻肉品，炭烤、燒烤肉食，容易致癌因為這些食品具有大量的異環胺和多環芳香烴。,1
高蛋白含量的食物在高於150度的溫度下長期烹煮會容易致癌。,1
燒烤食品會產生異環胺和多環芳香烴，這兩種東西都會致癌，要避免用高溫或長時間料理。,1
避免過量攝取肉類或加工食品，減少高蛋白含量食物的烹調時間，均衡的攝取營養，才是健康王道。,1
蛋白質在高溫下會產生異環胺，甚至產生致癌性高的多環芳香烴，對人體造成傷害。,1
提出烹煮肉類對人體的壞處，也提醒人們應盡量避免食用肉類及加工食品，應均衡營養。,1
少吃易致癌的食物，像是燒烤、由炸等。,1
高蛋白質的食物在高溫烹煮下易產生致癌性的物質，可以的話盡量減少高溫烹煮的時間，避免攝取過多的肉類。,1
這篇所要傳遞的訊息是只要含量有高蛋白質的食物，就應該少吃一些，因為那些食物產生的致癌性很高。,1
避免過量攝取肉類或加工食品，均衡攝取營養，才是健康王道。,1
高蛋白質含量的食物在高於150度的溫度下烹煮會產生異環胺，甚至產生致癌性高的多環芳香烴。避免過量攝取均衡飲食才是健康王道。,1
減少異環胺的生成，避免提高罹患癌症的風險。異環胺、多環芳香烴經特殊酵素代謝後可破壞DNA而致癌，因此應減少攝取。,1
這篇文章告訴我們炭烤或燒烤類的食物，對我們人體有一定的傷害，要我們均衡的攝取營養，才有健康的身體。,1
避免過量攝取肉類或加工食品，均衡攝取營養才是健康王道。,1
高蛋白的食物在高溫下烹煮會因變性而產生異環胺，過多的異環胺生成會導致致癌性高多環芳香烴產生。,1
在食用肉製品食，不宜溫度過高的烹煮，尤其是以?燒烤?的方式；應少食用加工食品，選擇營養並均衡得飲食。,1
高蛋白質在高於一百五十度食會具有大量的異環胺和多環芳香烴，要少吃肉類和加工食品。,1
高蛋白質因含有胺基酸和肌酸，當在高溫下蛋白質會分解或變性產生異環胺，當生產越多，就會提高罹患癌症機率。,1
高蛋白質含量的食物如過於加熱易產生致癌物，應先以微波爐料理，減少烹煮時間以免過熱。,1
國人或是西方人常用的燒烤肉食因高於150度的溫度烹煮時會產生多環芳香烴，這會使人提高致癌，罹患大腸癌的風險，應該要少吃一點。,1
高蛋白質含量的食物在溫度越高，加溫時間越長，在火焰下直接燒炙的烹煮方式下，吃了會提高罹癌機率。,1
高蛋白質含量的食物，在火焰下直接燒烤，會提高罹患大腸癌的風險。,1
少吃高蛋白質的食物，若要吃則溫度不要太高，時間越短越好。,1
減少異環胺的生成，避免肉類直接暴露於火焰中，或長時間高溫烹煮，避免過量攝取肉類或加工食品，均衡攝取營養。,1
高蛋白質的食物如牛、豬、魚、雞肉，若攝取大量燒烤、油炸的肉類，會提高罹患大腸癌的風險，烤肉時要防止局部過熱、避免烤焦。,1
高蛋白質含量的食物，並不適合在高溫下燒炙及長時間的加溫，會產生致癌性高的物質，應少吃燒烤及煙燻肉品，並均衡營養，才是健康王道。,1
高蛋白質含量的肉類應避免直接暴露在火焰中或是長時間在高溫下烹煮，因會導致致癌因子的形成。,1
高蛋白質的食物容易導致致癌，因此要避免過量攝取肉類或加工食品，均衡飲食才是健康王道。,1
高蛋白質中因富含胺基酸和肌酸，而且太高溫會導致身體不健康，致癌的風險。要均衡攝取才健康。,1
本文主要傳遞訊息為希望我們可以盡量避免讓肉類直接暴露在火焰中，以減少異環胺的生成，免於癌症。,1
烤肉時要防止局部過熱，可避免產生過多異環胺甚至是致癌物質。也盡量避免過量攝取肉類或加工食品。,1
高蛋白的食物富含胺基酸和肌酸，高於150度烹煮，導致異環胺生成，均衡飲食才是王道。,1
這文章是想表達，這些化學加工食品吃太多容易致癌，最好以少吃肉多吃菜為主，告訴人們要有均衡飲食的概念。,1
肉類內含有胺基酸和肌酸，在過高的溫度烹煮時，蛋白質會分解或變性而產生異環胺，要我們不要吃太多燒烤油炸類。,1
高蛋白的食物，在高溫烹煮易產生對人體有害物質，加工製成高溫烹煮也會產生有害物質，烹煮這些食物時也會產生有害物質，烹煮這些食物時減少烹煮時間。,1
這篇文章主要在講：牛、豬、魚、雞肉是高蛋白質的食物，這些食物在高於150度的溫度烹煮食，蛋白質會分解一種叫異環胺的物質，這樣會產生致癌性的多環芳香烴，這兩種物質會被體內的酵素代謝活化後，有可能去多壞去氧核醣核酸，所以要均衡攝取營養。,1
