高蛋白質的肉類，因富含胺基酸和肌酸，在高溫烹煮下，會產生有害的異環胺，隨著時間拉長，更可能產生致癌物質。,2
人類應少吃經由高溫烹煮的高蛋白食物，因為高溫烹煮後的蛋白質會?性分解而產生異環胺等有害物質，影響身体健康。,2
高蛋白質含量的食物因富含胺基酸和肌酸，在高溫下烹煮會產生對人體有害、異致癌的物質。,2
高蛋白食物經高溫烹煮易產生致癌性物質，攝取過多會提高大腸癌機率，應減少高溫烹調時間，且均衡攝取營養。,2
高蛋白質的肉在溫度高、加熱時間長的情況下會產生致癌物。避免攝取太多肉類或加工食品，均衡攝取營養。,2
高蛋白質的肉類經高溫燒烤會產生致癌物，國人烤肉時應避免肉類烤焦及不要過度攝取，均衡飲食，才能健康。,2
含有高蛋白質的食物，在高溫或是長時間烹煮會產生致癌物質。應避免烤焦及過量攝取，或以微波爐料理為佳。,2
高蛋白質含量的食物因含胺基酸和肌酸，在高溫烹煮時會產生異環胺和多環芳香烴，兩者活化後會破壞DNA因而致癌。,2
高蛋白質含量的食物在高溫下烹煮易產生致癌物質，烤肉時可以微波爐處理，避免烤焦，但均衡飲食才是健康王道。,1
避免過量攝取肉類及加工食品，均衡攝取營養，健康跟著我。,1
均衡攝取營養，才是健康王道。,1
在火焰下直接燒炙的高蛋白食物，會產生致癌性高的多環芳香烴(polyaromatic-hydeocarbons，PAHS)。,1
高蛋白質含量的食物，因富含胺基酸和基酸，在高溫下會產生致癌性高的食物，要避免可減少在高溫下烹煮，或以微波爐料理。,1
高蛋白質富含胺基酸和肌酸的物質，如在長時間內烹煮，會使蛋白質分解出許多異環胺，導致罹癌機率提高。,1
高蛋白質含量的食物需減少直接暴露在火焰中或長時間的高溫烹煮，避免產生致癌性高的多環芳香烴。,1
烤肉時要防止局部過熱，避免烤焦。當然避免過量攝取營養，才是健康王道。,1
因國人都喜歡吃炭烤及燒烤類，但是這些東西都是長時間加工製成的煙燻肉品，吃多了會產生致癌，所以作者建議讀者們，可以先將肉放進微波爐後再將肉拿去烤，減少易環胺的生成，才能保健自己的身體。,1
溫度越高，加溫時間越長，在火焰下直接燒炙，會導致更多易環胺的生成，甚至產生癌性高的多環芳香烴。這兩類物質被體內經特殊的酵素代謝活化，可能去氧核醣核酸，因而致癌。,1
這兩個東西在體內經由特殊酵素代謝後，有可能去破壞去氧核醣核酸，因而致癌。國人熱愛中秋節烤肉，或者西方美食燒烤，還有長時間在高溫加工製成的肉品，都有可能具有大量的易環胺和多環香烴，若要減少異環胺的生成，應避免長時間高溫下烹煮，當然均衡的飲食才是健康之路。,1
以高於150度西的溫度烹煮時，蛋白質會產生變性異環胺，使肉質酵素代謝活化後，破壞去氧核醣核酸因而致癌。,1
避免肉類直接暴露在火焰中，或是長時間在高溫下烹煮，減少高溫烹調的時間，降低致癌風險。,1
長期食用高溫加工成的煙燻肉品，會因為加熱過程中烤焦或釋放物質，導致癌症的發生。,1
用高於150度西的溫度烹煮高蛋質含量的食物如牛、豬、魚、肌肉，因富含胺基酸和肌酸，溫度越高加溫過久會產生致癌性高的多環芳香烴。,1
高蛋質含量的食物如牛、豬、魚、肌肉，因富含胺基酸於150度西的溫度會產生致癌物，所以要多多攝取蔬菜，很營養。,1
攝取大量燒烤、油炸的肉類，容易罹患大腸癌，還有長時間高溫加工製成的煙燻肉品也是其中之一。要防止肉類在長時間烹煮，可以先以微波爐料理。,1
牛、豬、魚、雞肉富含胺基酸和肌酸，在高溫、長時間烹煮，直接燒炙下，會產生更多異環胺生成，而引發致癌物質多環芳香烴。,1
高蛋白質含胺基酸和肌酸，若高於150度的溫度烹煮時，他會分解或變異成異環胺，是正常的，但溫度越高煮得時間越長，會產生致癌的多環香烴。,1
避免肉類在火焰中烤炙，減少高溫烹調的時間，應能有效降低至癌機會發生。,1
高蛋白質含量的食物在溫度越高，加溫時間越長，在火焰下直接燒炙會容易致癌。,1
高蛋白時的食物如超過150度時，會產生許多的致癌物質。選擇食物時?營養?是最重要的，加工食物盡量不要。,1
如長期食用肉類或加工食品，或者火焰下直接燒炙，會比常人更容易導致異環胺的生成，甚至產生致癌性高的多環芳香烴。,1
在高於150度的溫度烹煮，蛋白質會分解產生異環胺，溫度越高，加溫時間越長，在火焰下直接燒炙，會產生致癌性高的多環芳香烴。,1
高蛋白的食物在高溫烹煮，會產生多異環胺和多環芳香烴，會致癌或大腸癌。,1
要減少異環胺的生成，可避免讓肉類直接暴露在火焰中，或是長時間在高溫下烹煮。均衡攝取營養，才是健康王道。,1
高蛋白質含量的食物，因富含胺基酸和肌酸，在高於150度的溫度烹煮食，蛋白質會分解或變性而產生異環胺。溫度過高，加溫時間越長，在火焰下直接燒炙，會導至更多異環胺的生成，甚至產生致癌性高的多環芳香烴。這兩類物質被體內經特殊的酵素代謝活化後，有可能破壞去氧核醣核酸，因而致癌。若攝取大量燒烤、油炸的肉類，會提高罹患大腸癌的風險。要減少異環胺的生成，可避免讓肉類直接暴露在火焰中、或是長時間在高溫下烹煮，或先以微波爐料理肉類，減少高溫烹調的時間。,1
高蛋白質食物會因高溫而變職，進而致癌，應避免高溫烹調、燒烤、烤焦。,1
避免攝取長時間在高溫加工裝成的肉類或加工食品，減少異環胺和多環芳香烴對我們的危害，均衡攝取營養才是健康王道。,1
在國人熱愛的中秋燒烤，肉類中因有安基酸和肌酸在經過火烤之後會產生變質，增加罹患大腸癌的機會。,1
高蛋白食含量的食物，多含有致癌性高的物質，尤其是長時間加熱後。所以我們應減少高溫烹調時間。,1
高蛋質含量食物，因富含胺基酸和肌酸，在高於150度的溫度烹煮食，蛋白質會分解行成致癌性物質，所以在吃烤肉或燒烤食，可避免讓肉類暴露在火中或高溫之下又或者是先以微波爐料理。,1
一、我覺得這篇文章，主要告訴我們要如何預防癌症，但在生活中多少一定會食用到這些食物，所以我們要均衡攝取營養，才是抗癌的主要方法。,1
不要把牛、豬、魚、雞肉這幾樣高蛋白質的食物，放在高於150度的溫度烹煮，不然蛋白質會分解產生異環胺及多環芳香烴，吃多了會提高罹患大腸癌的風險。,1
燒烤、煙薰這些烹煮方式，是常見以及常吃的但我們卻不知道肉品在高溫下會產生致癌物多環芳香烴、異環胺。,1
本文主要說明高蛋白含量的食物在高於150度的溫度烹煮食，會產生異環胺，溫度越高、加溫時間越長，直接火下燒烤，甚至會產生致癌物質性高的多環芳香烴。所以還是均衡攝取營養最健康。,1
文中主要是在說明肉品在高於溫度150度的情況下會產生對人體有害物質，而我們在飲食習慣上如烤肉、吃燒烤、油炸等時常會把這些物質吃下肚，所以避免過度食用先改變料理的方式讓我們減少吸收這些容易致癌的物質。,1
因富含胺基酸和肌酸，在高於150度的溫度烹煮食，蛋白質會分解或變性而產生異環胺的生成，甚至產生致癌性高的多環芳香烴。,1
如果要吃高蛋質食物，不要直接以火燒食，也不要長時間烹煮，否則產生異環胺及多環芳香烴的話，對人體內有極大威脅，最好避開。,1
高蛋白得食品應避於高溫，即可減少致癌物的生成。,1
高蛋白質含量的食物因富含胺基酸及肌酸應避免暴露在火焰及高溫油炸烹煮防止致癌物產生。,1
高蛋白質含量的食物，因富含胺基酸和肌酸，因此在高溫150度以上烹煮可能導致去氧核醣核酸被破壞、因而致癌。,1
異環胺和多環芳香烴被體內經特殊的酵素代謝活化後，有可能破壞去氧核醣核酸，因而致癌。燒烤、油炸，提高罹癌風險。,1
許多肉類在高溫烹煮或在火焰下直接燒炙，溫度越高、加溫時間越久，會導致更多異環胺的生成，甚至產生致癌性高的多環芳香烴，對人體是非常大的傷害。,1
異環胺及多環芳香烴這兩類物質經體內特殊的酵素代謝活化後，可能破壞去氧核醣核酸，因而致癌。,1
這文章所傳遞的訊息是在說，高蛋白的食物如牛、豬、魚、雞肉，友含胺基酸和肌酸。少吃燒烤肉食，在火焰下直接燒炙才會有致癌性物質，平常一般的加熱方式產生異環胺是正常的。,1
本文傳第的訊息是，高蛋白質含量的食物要避面在高於一百五十度的高溫下長時間烹煮，否則會容易致癌。,1
牛、豬、魚、雞肉這些高蛋白質含量的食物，富含胺基酸和肌酸，在高溫烹煮下，將產生異環胺，越高溫越長時越多。,1
本文要傳遞的訊息為，直接暴露在火焰中或是長時間高溫烹煮的肉類。食用後會提高罹患大腸癌的風險。要避免過量食用。,1
牛、豬、魚、雞擁有高蛋白，烹調時溫度越高、加溫時間越長，可能會致癌。,1
高蛋白食物在一百五十度高溫烹煮時會使蛋白質分解或是變性，烹調時間越長，溫度越高還會產生有害物質，甚至有致癌的風險。人們應避免過量攝取。,1
現在人常吃如：燒烤及油炸類的食物，多吃的許會提高罹患大腸癌的風險，而我臺灣人最愛吃這些比如說：學生們一放學就會在鹽酥雞店的前集合，而上班族因趕時間則會選擇在附近店家買小吃，這些小吃雖然美味，但如果當正餐的話只會對身體造成危害而已。我們還是可以吃；但也不要過量，如果想要擁有健朗的身體要多吃青菜以攝取營養，才是健康的王道。,1
這兩類物質被體內經特殊的酵素代謝活化後，有可能破壞去氧核醣核酸，因此致癌。攝取大量燒烤會患大腸癌。,1
健康從習慣開始，大家都知道中秋節慶就該烤肉慶團圓，但從未想過吃下肚的事不是健康，中秋本是慶團圓，養成好的飲食習慣，別讓食物換了自己。,1
本文要傳遞的訊息，牛豬魚雞等四肉，在高於一百五十度的溫度烹煮、燒炙下，會產生異環胺，多環芳香烴兩物質，兩物質非常危險，有機率致癌。,1
它主要是說，若是肉類長時間在火上烤會散出一些致癌的物質。,1
如何避免攝取過多高蛋白質食物，減少致癌風險。,1
盡量避免高蛋白食物在高於150度烹煮，也避免加工食品以炭烤、燒烤、油炸方式長時間烹煮，因為容易罹患大腸癌。,1
從本文中，可以知道在煮東西的時候，溫度、時間要控制好，不然可能產生致癌性高的多環芳香烴。,1
牛、豬、魚、雞肉，因富含胺基酸和肌酸，在高於150度的溫度烹煮食，蛋白質會分解或變性而產生異環胺。,1
高蛋白的食物含量的含胺基酸和肌酸較高，在高溫下烹煮食蛋白質會分解或變異進而產生致癌物。加工製品的食物要含有大量的異環胺及多環芳香烴，減少這些物質產生，避免在高溫下烹煮時間及少攝取。,1
平常我們認為食物加熱就可安心食用，但卻不能過熱，過熱把食物裡的養分流失掉，甚至還引來癌症的起端，所以吃熟食固然放心，但還是要注意一下是否有時間過久的烹煮和烤焦的食物。,1
如果高蛋白質的食物用高溫烹煮、炭烤時，會釋放出許多可能會致癌的物質，建議先用微波爐稍加熱減少煮烤時間。,1
高蛋質含量的食物，在火焰下直接燒炙，會產生對人體有害的致癌物，因此在處理這些高蛋白含量食物食，應注意烹調方式，而避免攝取過量的肉量或加工食品才是更重要的。,1
多些高蛋白含量的食物富含胺基酸及肌酸，在高溫烹煮時蛋白質會變性而產生異環胺，溫度越高會導致異環胺的生成，甚至產生致癌性高的多環芳香烴。,1
高蛋白質的食物若經過長時間烹煮會產生異環胺，此物質吃多了會致癌，過多的燒烤、油炸也會提高罹癌風險，少吃為妙。,1
食用高蛋白的肉類及其製品，不要在高溫烹調下太久，否則會產生致癌性的多環芳香烴，大量攝取會提高大腸癌風險。,1
烤肉食如果要減少異環胺的生成，可避免讓肉類直接暴露在火焰中，或是減少高溫烹調的時間；而且還要避免烤焦。,1
肉類在高溫烹煮時會產生異環胺，這是正常的物質，但太久則會產生有致癌性的多環芳香烴。這兩類物質被體內經特殊的酵素代謝活化後，有可能破壞去氧核醣核酸，因而致癌。避免過量攝取加工食品。,1
主要是說肉類如果直接暴露在火焰中會有較大量的異環胺以及多環芳香烴這樣不但會讓身體有致癌的疾病如果長時間的烹煮這些被分解的物質會遺留在身體裡，所以利用微波爐料理並可以均衡攝取營養。,1
高蛋白質食物因含有胺基酸和肌酸在高於150度的溫度會產生致癌物，而國人最愛的烤肉都含有大量致癌物，料理肉類食品應避免烤焦以及少吃加工食品才是健康王道。,1
文中說了很多有關一些肉類的富含物質，告訴我們裡面有哪些東西，如果溫度很高會產生致癌物質，讓我們少用烤的會產生很多的致癌物，也不要一直只吃肉，希望我們均衡攝取營養，身體健康才是好的。,1
文章裡提到攝取大量燒烤、油炸的肉類會提高罹患大腸癌的風險，還有以長時間在高溫加工製成的煙燻肉品也不好。,1
本文的主旨在於燒烤肉類時，對烹調的時間的減少，防止局部過熱避免烤焦，以降低食用後會罹患的風險。,1
高蛋白質含量的食物在高溫或火焰下直接烤，會導致更多異環胺的生成，有可能破壞去氧核醣核酸，因而致癌。,1
這兩類物質被體內經特殊的酵素代謝活化後，有可能顯示，若攝取大量燒烤、油炸的肉類，會提高罹患大腸癌的風險。,1
高蛋白的食物在遇熱的環境下會破壞本身的營養成分，甚至會危害到人體。所以要儘量避免讓高蛋白的食物過熱會烤焦。,1
高蛋白的食物，因有安基酸和肌酸，在高溫下超久會產生致癌物質，破壞DNA，患大腸癌，因少吃這類食品。,1
高於150度的溫度會分解，變性而產生異環胺，溫度越高、加溫時間越長、在火焰下直接燒炙，會產生致癌性高的多環芳香烴。,1
高蛋白質含量最多的是牛、豬、魚、雞肉，因富有含胺基酸。,1
避免讓肉類長時間烹煮，溫度過度會使蛋白質分解變性產生異環胺的生成，甚至產生出致癌的多環芳香烴，多環芳香烴在體內經特殊酵素代謝，會破壞去氧核醣核酸，容易致癌，能少吃燒烤或油炸肉類就少吃，較為宜。,1
牛、豬、魚、雞肉不可以放在高溫下，不然會產生異環胺，而溫度越高時間越久產生氣體越多，吸多容易得大腸癌。,1
主要傳達的是不管豬肉、牛肉、魚、雞肉，只要高於一定的溫度就會對人體有害健康，主要盡量不要吃加工過的食品或燒烤，那不然越吃越不健康。,1
若攝取大量燒烤、油炸的肉類，可能破壞去氧核醣核酸，提高提患大腸癌的風險。要避免讓肉類直接暴露在火焰中或是長時間高溫烹煮，也要避免烤焦，而攝取過量肉類或加工食品也會使營養不均衡，所以要盡量均衡營養，才是維持健康的王道。,1
畜牧食物都不適合太高溫烹煮，會產生食品的營養改變，而大眾吃了都會造成身體健康的傷害。,1
高蛋白質含量的食物如牛、豬、雞肉只要處於150度的高溫下烹煮時，蛋白質就會分解或變性而產生異環胺，如果吃太多燒烤類和油炸類的食品罹患大腸癌的風險會提升，盡量避免吃油炸類食品。,1
避免肉類在高溫下烹調、避免過度食用加工食品。,1
近幾年台灣罹癌第一名就是大腸癌，臺灣人又盛行中秋烤肉，這些肉因富含胺基酸和肌酸，溫度越高加溫越長在火焰下直接炙燒，會導致異環胺跟多環芳香烴的生成，這些物質都是罹癌的有壞物質，要減少國人的罹癌機率就要從飲食習慣改起，少吃炭烤及油炸的食物，才是健康的第一步驟。,1
高溫加工得肉品，具大量致癌物，盡量減少烹調時間，才是健康的王道。,1
當蛋白質的東西遇熱時間長或在火焰下直接燒炙，會對人體產生有害；所以在烹調時避免過焦而產生對人體有害的物質，可以先用微波方式或減少高溫烹調的時間，來降低蛋白質遇熱太久而產生的有害物質，均衡攝取營養才是最健康的。,1
烹調因減少高溫加熱時間，烤肉食要防止局部焦黑。但是避免攝取過量肉類加工食品，才是健康。,1
要讓我們有健康的身體，讓我們如何注意飲食的習慣。,1
蛋白質的食物不可用高溫加熱，而且吃多了會對自己的身體有害，少吃加熱過的蛋白質食品，維護自己的健康。,1
胺基酸和肌酸在溫度過高的情況下，導致更多異環胺的生成，在許多肉類中經過長時間的烹調後，都會釋放出對人體有害的因子。,1
要減少異環胺的生成，可避免讓肉類直接暴露在火焰中，或是長時間在高溫下烹煮。,1
食物對我們人來說是每天必定要攝取的飲食，但是，現在很多食物都是致癌物，能少吃一些燒烤類、油炸類的肉食品越好，因為很多都是加工食品，每個人應該多攝取蔬果，這樣才會營養均衡，每個人都均衡飲食，才是健康王道。,1
牛、豬、魚、雞肉都是含有高蛋白質的食物，但是高於一定溫度下，蛋白質就會劣變，就會增加致癌的風險。,1
要多多攝取蔬食均衡飲食，才是王道。,1
烤肉時避免肉類直接暴露在火中，若要烤肉的話，請先以微波爐微波，減少肉類高溫烹調得時間過久，烤肉食防止局部燒烤，防止烤焦，避免攝取過量的肉類式加工食品，才是養身之道。,1
在烹煮肉類的食物時，烹煮高溫不可高於150度，以避免提高致癌機率。,1
避免過量攝取肉類或加工食品，均衡攝取營養，才是健康王道。,1
因攝取過多的營養會導致身體上的負擔，加上烹煮的方法，例如：烤肉、燒烤及炭烤應少吃，減少身體的負擔。,1
希望國人能均衡攝取營養，也避免過量高溫高油肉類或加工食品類。,1
高蛋白質含量的食物，在高於150度的溫度烹煮時，蛋白質會分解或變性而產生異環胺，但這是正常物質。溫度、加溫時間越高，在火焰下直接燒炙，會出現更多異環胺生成，甚至產生致癌性更高的多環芳香烴。避免過量加工食品，要均衡飲食。,1
含高蛋白質的食物經高溫炭烤之後會產生異環胺及多環芳相輕，會增加罹患大腸癌的機率。,1
本文要傳遞的訊息就是不要吃太多炭烤，尤其是燒焦的部位，也應避免食物長時間烹煮，以免罹癌。,1
蛋白質物質所含的物質以及用何種方式烹煮會造成身體的負擔，強調健康的重要性。,1
希望肉品盡量避免過量攝取或燒烤、油炸的烹煮方次，避免引起對自己產生有害的疾病。,1
蛋白質在高於150度的溫度下，會分解或變形產生異環胺，但異環胺屬正常產生的物質，持續加熱下，異環胺則會產生致癌性高的多環芳香烴。,1
本文想傳遞的訊息是要國人少吃炭烤及油炸物，因為這些食物都要經過加工和高溫烹煮，在這期間食物會因而產生變化。,1
避免攝取過量的加工製品，要均衡攝取營養才是王道。,1
有許多食物富含胺基酸，但在高溫烹煮後可能變成有害物質，對人體造成傷害，還可能產生致癌性的物質，所以我們避免過度烹煮，使其產生毒物，才能攝取真正的營養。,1
肉只要高於一百五十度烹煮時，就會變性產生異環胺，會產生致癌性的多環芳香烴，因而致癌。,1
高蛋白質的食物在高溫下會產生多環芳香烴，如果大量食用燒烤、油炸的肉類，會提高大腸癌的風險，不可過度食用肉類。,1
肉類在高溫烹煮後，蛋白質會分解產生異環胺，而這是正常物質。但若大量攝取了長時間高溫燒炙油炸的肉類，將提高罹患大腸癌的風險。,1
是在說明含高蛋白質的食物不直在高溫下烹煮太久，容易形成致癌物質。,1
只要是牛、豬、魚、雞肉等含胺基酸，只要高於150度的高溫，吃下肚對人體就會產生傷害，當然也要均衡營養。,1
少吃炭烤的東西，因為長時間在高溫加工製成的煙燻肉品，都具有大量的異環胺及多環芳香烴，對人體有害。,1
高蛋白質的食物裡含有胺基酸和肌酸，在高溫中皆會分解出異環胺等致癌性物質。減少烹調時間，減少致癌風險。,1
高蛋白質含量的食物，因富含胺基酸和肌酸，於高溫烹煮會變性產生異環胺，易致癌，若要吃的健康可採用減少時間或用量。,1
高蛋白質含量的食物於溫度高會產生異環胺，多環芳香烴，這兩個物質驚人體的酵素代謝活化後會破壞去氧核醣核酸因而致癌，要減少致癌物質的生成應避免過量攝取肉類或加工食品。,1
降量避免食用長時間在高溫加工製成的煙燻肉品，還有不要讓肉類直接暴露在火焰中或長時間在高溫下烹煮，烤肉時要防止局部過熱以免烤焦，可降低罹患大腸癌的風險。,1
提醒國人注意飲食，盡量避免食用高溫烹煮的肉類，才不會造成身體的負擔，減少罹患癌症的機率。,1
不要將高蛋白的食物直接暴露在火焰中，或是長時間在高溫下烹煮，這樣就可以降低罹患癌症的機率。,1
蛋白質為人不可獲缺之養分，而牛、豬、魚、雞，肉類之中，皆含有豐富蛋白質，然而烹調的方式將有可能反到沒攝取營養而有致癌發生。,1
牛、豬、魚、雞肉，因富含胺基酸和肌酸，在高於150得溫度烹煮時，蛋白質會分解產生主要異環胺，甚至產生致癌性高的物質，這種物質的酵素代謝活化後會提高大腸癌的風險。,1
國人熱愛中秋節燒烤，卻不知道這就讓癌症找上門原因之一。更不知道自己罹患癌症因由為何。而平日裡人們也愛吃油炸食品以及煙燻肉品這些都是高溫、時間長、火焰下直接燒炙，這些會更多的多異環胺生成，甚至提高癌症罹患率。,1
少量攝取肉類和加工食品，應多攝取蔬菜水果。飲食均衡才是健康王道。攝取過多的燒烤油炸的食品，容易罹患癌症。,1
均衡的攝取營養，才是健康的王道。,1
我們人不要攝取大量燒烤、油炸，而導致提高罹患大腸癌的風險，雖然國人很愛中秋炭烤，可是不要把肉類一直的放在火焰中會有很多異環胺跟多環芳香烴的生成。,1
高蛋白含量的食物：因富含胺基酸和肌酸，如在高溫下烹煮，蛋白質將異變產生異環胺，甚至於致癌性高的多環芳香烴。,1
高蛋白質含胺基酸和肌酸，這兩類物質被體內經特殊的酵素活化後，可能破壞去氧核醣核酸，因而致癌。,1
高蛋白質不可以在超過150度之間長時間的加溫，溫度越高形成多異環胺的生成會增加，並因而致癌。,1
現在的人幾乎都吃外食，尤其是烤肉，炭烤之類的，卻不知道容易致癌，所以要多吃蔬果，保持健康。,1
牛、豬、魚、雞含胺基酸和肌酸，不宜長時間加熱或在火焰下直接炙烤、容易致癌。,1
因為這些食物在高溫更容易產生有毒物，所以燒烤食物少吃。,1
肉類含高蛋白，若在高於150度的溫度下烹煮，會產生異環胺，異環胺越多致癌性越高，所以要避免肉類在高溫下烹煮時間過久。,1
烹調的方式，會破壞酵素，所以在烹調任何的食材時，要先想是否會影響健康。,1
少使用肉品，直接接觸火焰才不會讓它產生一些對人體有害物質，例如：烤肉或燒烤，少吃加工食品，均衡飲食，才是健康王道。,1
它要說明的是，油炸類、炭烤類的食物不要常吃，烤焦的要去掉，要攝取適當的蔬果，才會健康。,1
應避免吃過多燒烤、油炸肉類，降低大腸癌罹患機率。,1
牛豬雞魚肉內含有胺基酸或肌酸，在高於150度的溫度烹煮食會蛋白質分解成或變性異環胺，是正常的物質產生。不過加熱時間長溫度也一直上升致癌性更高，那如果大量吃燒烤及油炸肉類，也會罹患大腸癌。所以要均衡飲食。,1
